{
  "protocol": "feam.web.event.v1",
  "event_id": "00000000-0000-4000-8000-000000000001",
  "stream_id": "00000000-0000-4000-8000-000000000002",
  "sequence": 1,
  "deployment_id": "00000000-0000-4000-8000-000000000002",
  "workspace_id": "00000000-0000-4000-8000-000000000003",
  "generation": 1,
  "participant_id": "00000000-0000-4000-8000-000000000004",
  "conversation_id": "00000000-0000-4000-8000-000000000001",
  "request_id": "00000000-0000-4000-8000-000000000002",
  "proposal_id": null,
  "occurred_at": "2026-09-25T00:00:00Z",
  "kind": "outcome",
  "trust": "client_reported",
  "software_sha256": "0000000000000000000000000000000000000000000000000000000000000000",
  "profile_sha256": "1111111111111111111111111111111111111111111111111111111111111111",
  "dataset_sha256": "2222222222222222222222222222222222222222222222222222222222222222",
  "payload_sha256": "3333333333333333333333333333333333333333333333333333333333333333"
}
